brand,product,price,benefits,oneliner,img,ingredients,description,category,sub-category
Kylie Skin,Eye Cream,$35.00 ,VeganSulphate-freeParaben-free,"Brightening, antioxidant-rich cream",https://www.mecca.com.au/on/demandware.static/-/Sites-mecca-online-catalog/default/dw0af48836/product/kylies/hr/i-047474-eye-cream-1-940.jpg,"Water/aqua/ eau, simmondsia chinensis (jojoba) seed oil, butyrospermum parkii (shea) butter, polyglyceryl-3 rice branate, glycerin, coconut alkanes, cetearyl alcohol, propanediol, polyglyceryl-6 distearate, cetyl phosphate, polyacrylate-13, isododecane, phenoxyethanol, caprylyl glycol, glyceryl stearate citrate, tetrahexyldecyl ascorbate, polyisobutene, mica, dimethicone crosspolymer, titanium dioxide (ci 77891) coco-caprylate/caprate, candelilla/ jojoba/rice bran polyglyceryl-3 esters, cetyl alcohol, acrylates/c10-30 alkyl acrylate crosspolymer, sodium hydroxide, polyglyceryl-3 cocoate, polyglyceryl-4 caprate, polyglyceryl-6 caprylate, polyglyceryl-6 ricinoleate, camellia sinensis leaf extract, lactobacillus ferment lysate, polymethylsilsesquioxane, punica granatum extract, trisodium ethylenediamine disuccinate, ethylhexylglycerin, hdi/trimethylol hexyllactone crosspolymer, polysorbate 20, iron oxides (ci 77491), sorbitan isostearate, 3-o-ethyl ascorbic acid, tocopheryl acetate, lactobacillus ferment, caffeine, tocopherol, actinidia chinensis (kiwi) seed oil, citric acid, glyceryl stearate, sodium stearoyl lactylate","The delicate eye area needs extra TLC and this cream delivers that in spades. Formulated with caffeine, green tea, and pomegranate extracts as well as shea butter, jojoba oil and vitamins E and C, this nourishing eye cream helps to brighten, hydrate, fight dark circles, reduce puffiness and the appearance of fine lines and wrinkles. It s a potent recipe designed to treat and care for the eyes.",Eye Care,
Go-To,12 Days of Go-To,$150.00 ,,12 days of mini size Go-To treats.,https://www.mecca.com.au/on/demandware.static/-/Sites-mecca-online-catalog/default/dwde20d8c7/product/goto/hr/i-045836-12-days-of-go-to-1-940.jpg,"Water, propanediol, Betaine, Sodium ascorbyl phosphate, Niacinamide, Saccharide isomerate, Kakadu plum extract, Finger lime extract, Tasmanian Pepper Leaf extract, Glucomannan, Pseudoalteromonas Exopolysaccharides, Xanthan gum, Dehydroacetic acid, Heptyl glucoside, Ethanol, Benzyl Alcohol, Natural Fragrance (peony and white jasmine), Sunflower oil, sweet almond oil, caprylic/capric triglyceride, camellia oil, passion fruit seed oil, polyglyceryl-2 sesquioleate, argan oil, isoamyl laurate, vitamin e, polyglyceryl-2 caprate, natural fragrance (roses, tuberoses and gardenias), rosemary leaf extract, Almond oil, jojoba oil, macadamia oil, brazil nut oil, evening primrose oil, buriti oil, arnica oil, rosehip oil, calendula oil, kiwi fruit seed oil, tocopherol (vitamin e), totarol, rosemary leaf extract, natural fragrance (orange blossom & rose gardenia.), Water, sodium cocoamphoacetate, glycerin, lauryl glucoside, sodium cocoyl glutamate, sodium lauryl glucose carboxylate, sodium chloride, dehydroacetic acid, benzyl alcohol, citric acid, white willow bark extract, natural fragrance (ginger, mandarin and lime), Water, shea butter, sweet almond oil, apricot kernel oil, glyceryl oleate citrate, amla berry extract, arachidyl alcohol, behenyl alcohol, avocado oil, sunflower oil, mango butter, milk thistle ethyl ester, benzyl alcohol, coenzyme q10, arachidyl glucoside, vitamin e, sodium citrate, lysolecithin, sclerotium gum, xanthan gum, pullulan, dehydroacetic acid, natural fragrance (fig and oriental rose), Water, shea butter, ethyl macadamiate, amla berry extract, cupuacu butter, cocoa butter, betaine, glyceryl oleate citrate, arachidyl alcohol, macadamia oil, jojoba esters, behenyl alcohol, xanthan gum, benzyl alcohol, arachidyl glucoside, tocopherol, natural fragrance (gourmand orange blossom rose), sodium citrate, dehydroacetic acid, Ultra medical grade lanolin, shea butter, apricot kernel oil, beeswax, sweet almond oil, evening primrose oil, vitamin e, fragrance (pure pomegranate), pomegranate seed oil, calendula oil, jojoba oil, avocado oil, Water, zinc oxide (nano), caprylic/capric triglyceride, propanediol, cetostearyl alcohol, betaine, shea butter, coco-glucoside, sorbitan olivate, natural fragrance (geranium and pomegranate), glycerol isostearate, beeswax, lecithin, milk thistle ethyl ester, coenzyme q10, vitamin e, saccharide isomerate, polygonum aviculare extract (natural knotgrass extract), glycerin, sunflower oil, xanthan gum, sodium chloride, glyceryl caprylate, polyhydroxystearic acid, cerium oxide, stearic acid, caprylhydroxamic acid, Water, coconut oil, sweet almond oil, shea butter, glycerin, squalane, cetearyl olivate, sorbitan olivate, beeswax, saccharide isomerate, sunflower seed oil, chamomile leaf extract, licorice root extract, gotu kola extract, rosemary leaf extract, baikal skullcap root extract, green tea leaf extract, japanese knotweed root extract, vitamin e, xanthan gum, cetyl palmitate, sorbitan palmitate, benzyl alcohol, sodium citrate, dehydroacetic acid, citric acid, natural fragrance (contains pink pepper, black pepper, buchu, lemon, orange, and patchouli oils)","Give the gift of good skin this holiday season with this limited-edition advent calendar filled with 12 Go-To goodies. Included is a range of skincare, lip care, hand care and more. The 12 Days of Go-To features custom carton artwork by by Lynette Nangala Singleton, titled,  Ngapa Jukurrpa .",Skin Care Packs,
Kylie Skin,Vanilla Milk Toner,$38.00 ,VeganSulphate-freeParaben-freeAlcohol-free,"A gentle, purifying alcohol-free facial toner",https://www.mecca.com.au/on/demandware.static/-/Sites-mecca-online-catalog/default/dw7943ac73/product/kylies/hr/i-047479-vanilla-milk-toner-1-940.jpg,"Water/aqua/eau, glycerin, squalane, dicaprylyl ether, neopentyl glycol diethylhexanoate, phenoxyethanol, prunus armeniaca (apricot) kernel oil, pyrus malus (apple) fruit extract, sorbitan stearate, ppg-26-buteth-26, polyglyceryl-3 laurate, glyceryl stearate, peg-100 stearate, peg-40 hydrogenated castor oil, chlorphenesin, persea gratissima (avocado) oil, prunus amygdalus dulcis (sweet almond) oil, musa sapientum (banana) leaf extract, sucrose cocoate, acrylates/c10-30 alkyl acrylate crosspolymer, simmondsia chinensis (jojoba) seed oil, fragrance (parfum), chondrus crispus extract, disodium edta, aminomethyl propanol, 1,2-hexanediol, sodium hyaluronate, hydroxyacetophenone, linalool, benzyl salicylate, hedychium coronarium root extract, tocopherol, actinidia chinensis (kiwi) seed oil","Free from harsh alcohols, this facial toner has been formulated to purify, hydrate and soothe skin rather than strip away natural moisture. Antioxidant-rich apple extract, squalane and sodium hyaluronate have been included to improve the look and feel of skin while hydrating. Jojoba seed, kiwi seed, avocado and apricot kernel oils have been included to soften and nourish. Lightly-fragranced, this toner smells like delicious vanilla milk and will slot seamlessly into any beauty routine. ",Cleanser & Toner,Toner
Kylie Skin,Foaming Face Wash,$40.00 ,VeganSulphate-freeParaben-free,"A gentle, foaming facial cleanser.",https://www.mecca.com.au/on/demandware.static/-/Sites-mecca-online-catalog/default/dwb8424b23/product/kylies/hr/i-047475-foaming-face-wash-1-940.jpg,"Water/aqua/eau, potassium cocoyl glycinate, cocamidopropyl betaine, potassium cocoate, glycerin, hydroxyacetophenone, 1,2-hexanediol, caprylyl glycol, trisodium ethylenediamine disuccinate, citric acid, polyquaternium-39, fragrance (parfum), sodium benzoate, actinidia chinensis (kiwi) seed oil, sodium hyaluronate, phenoxyethanol","This formula cleanses skin by helping to remove dirt, oil and makeup for a fresh, bright complexion. Infused with ultra-nourishing kiwi seed oil, glycerin and vitamins C and E to help maintain moisture and improve elasticity. ",Cleanser & Toner,Cleanser
Estée Lauder,Advanced Night Repair Synchronized Multi-Recovery Complex,$110.00 ,Hydrating,"An oil-free serum for firmer, hydrated skin.",https://www.mecca.com.au/on/demandware.static/-/Sites-mecca-online-catalog/default/dwdf888815/product/esteel/hr/i-047178-advanced-night-repair-synchronized-multi-recovery-complex-30ml-1-940.jpg,"Water/aqua/eau, bifida ferment lysate, peg-8, propanediol, bis-peg-18 methyl ether dimethyl silane, methyl gluceth-20, glycereth-26, peg-75, butylene glycol, adansonia digitata seed extract, tripeptide-32, sodium hyaluronate, yeast extract/faex/extrait de levure, lactobacillus ferment, cola acuminata (kola) seed extract, anthemis nobilis (chamomile) flower extract, hydrolyzed algin, pantethine, caffeine, lecithin, sodium rna, bisabolol, squalane, glycerin, oleth-3 phosphate, caprylyl glycol, oleth-3, oleth-5, choleth-24, hydrogenated lecithin, jojoba wax peg-120 esters, ceteth-24, tocopheryl acetate, carbomer, triethanolamine, tetrasodium edta, bht, xanthan gum, potassium sorbate, disodium edta, phenoxyethanol, red 4 (ci 14700), yellow 5 (ci 19140)","Hydrate and nourish skin with this next generation take on Est e Lauder s iconic Advanced Night Repair serum. With Chronolux  Power Signal Technology, this deep and fast-penetrating serum helps reduce the appearance of lines and wrinkles caused by environmental aggressors while plumping and firming. The oil-free formula delivers 72-hour hydration while simultaneously providing eight-hour antioxidant power and ensuring skin tone and texture is improved and pores look diminished. This dermatologist and ophthalmologist-tested, non-acnegenic serum leaves skin feeling refreshed and radiant. ",Treatment,Oils & Serums
Tatcha,Dewy Skin Favorites To Go,$96.00 ,HydratingBrighteningExfoliatingFirmingSulphate-freeParaben-free,Trio of Tatcha favourites for a dewy base.,https://www.mecca.com.au/on/demandware.static/-/Sites-mecca-online-catalog/default/dw8e93be5a/product/tatcha/hr/i-047545-dewy-skin-favorites-to-go-1-940.jpg,"Squalane, oryza sativa (rice) bran wax, cera alba/beeswax/cire d  abeille, saccharomyces/camellia sinensis leaf/cladosiphon okamuranus/rice ferment filtrate, melissa officinalis leaf extract, betaphycus gelatinum extract, sodium hyaluronate, tocopherol, aqua/water/eau, pentylene glycol, butylene glycol, propanediol, ethylhexylglycerin, phenoxyethanol, Aqua/water/eau, microcrystalline cellulose, propanediol, disodium cocoyl glutamate, glycerin, acrylates copolymer, glyceryl stearate, sodium caproyl methyltaurate, coco-betaine, parfum/fragrance, saccharomyces/camellia sinensis leaf/cladosiphon okamuranus/rice ferment filtrate, oryza sativa (rice) powder, chondrus crispus extract, sodium hyaluronate, betaphycus gelatinum extract, lauryl glucoside, potassium hydroxycitrate, disodium edta, phenoxyethanol, ethylhexylglycerin, alcohol, Aqua/water/eau, glycerin, squalane, cyclopentasiloxane, propanediol, triethylhexanoin, camellia japonica seed oil, saccharomyces/camellia sinensis leaf/cladosiphon okamuranus/rice ferment filtrate, sericin, glycyrrhiza glabra (licorice) root extract, oryza sativa (rice) germ oil, chondrus crispus extract, panax ginseng root extract, royal jelly extract, ziziphus jujuba fruit extract, thymus serpyllum extract, scutellaria baicalensis root extract, polyglyceryl-2 diisostearate, ppg-5-ceteth-10 phosphate, trideceth-12, sodium lauroyl lactylate, sorbitan stearate, ethylhexylglycerin, behenyl alcohol, glyceryl stearate se, parfum/fragrance, sodium hyaluronate, alcohol, phenoxyethanol","Keep your complexion in check and achieve a dewy glow (minus the shine) with this set of three Tatcha favourites. Included is the Tatcha Serum Stick 8g which provides targeted moisture and instantly helps to relieve the appearance of dry skin, Liquid Silk Canvas 10g an anti-ageing primer that protects against pollution and extends the wear of makeup, and lastly the Luminous Dewy Skin Mist 12ml, an ultra-fine mist that delivers immediate and intense hydration. ",Skin Care Packs,
Kylie Skin,Vitamin C Serum,$50.00 ,VeganSulphate-freeParaben-free,"A rich, non-greasy and glow-inducing serum",https://www.mecca.com.au/on/demandware.static/-/Sites-mecca-online-catalog/default/dw0a578d56/product/kylies/hr/i-047477-kylie-skin-vitamin-c-serum-1-940.jpg,"Water/aqua/eau, tetrahexyldecyl ascorbate, glycerin, phenoxyethanol, carthamus tinctorius (safflower) seed oil, ammonium acryloyldimethyltaurate/vp copolymer, dipalmitoyl hydroxyproline, tocopheryl acetate, tetrasodium glutamate diacetate, carbomer, polysorbate 20, sodium metabisulfite, panthenol, ferulic acid, ethylhexylglycerin, sodium hydroxide, camellia sinensis leaf extract","Fight dull skin and treat your complexion to a slew of brightening and hydrating ingredients. Formulated with vitamin C, camellia oleifera leaf and glycerin, this rich, non-greasy serum delivers on antioxidants, which work to protect and nourish while ensuring skin is hydrated and radiant. ",Treatment,Oils & Serums
Tatcha,Balanced Skin Travel Duo,$45.00 ,Oil freeSulphate-freeParaben-free,"Dynamic duo for hydrated, healthy skin.",https://www.mecca.com.au/on/demandware.static/-/Sites-mecca-online-catalog/default/dw88079027/product/tatcha/hr/i-045548-balanced-skin-travel-duo-1-940.jpg,"Aqua/water/eau, sodium cocoyl glutamate, propanediol, glycerin, acrylates copolymer, coco-betaine, saccharomyces/camellia sinensis leaf/cladosiphonokamuranus/rice ferment filtrate, luffa cylindrica fruit/leaf/stem extract, luffa cylindrica fruit, sodium lauroyl hydrolyzed silk, rosa multiflora fruit extract, belamcanda chinensis root extract, potassium hydroxide, sodium chloride, polyglyceryl-10 dioleate, polyglyceryl-2 sesquicaprylate, butylene glycol, ethylhexylglycerin, tetrasodium edta, parfum/fragrance, alcohol, phenoxyethanol, Aqua/water/eau, saccharomyces/camellia sinensis leaf/cladosiphon okamuranus/rice ferment filtrate, dimethicone, propanediol, glycerin, diglycerin, diphenylsiloxy phenyl trimethicone, gold, belamcanda chinensis root extract, rosa multiflora fruit extract, houttuynia cordata extract, sophora angustifolia root extract, sodium hyaluronate, lecithin, pistacia lentiscus (mastic) gum, sodium chloride, sodium citrate, mica, peg-9 polydimethylsiloxyethyl dimethicone, dimethicone/peg-10/15 crosspolymer, dimethicone/phenyl vinyl dimethicone crosspolymer, disodium edta, tin oxide, titanium dioxide, butylene glycol, ethylhexylglycerin, parfum/fragrance, alcohol, phenoxyethanol","Reach for this pair when you need reliable, effective skincare on the go. Tatcha s travel-friendly Deep Cleanse is a purifying gel cleanser infused with natural exfoliants and clarifying extracts from the Japanese luffa fruit that gently lifts impurities, unclogs pores, and balances skin moisture for a healthy-looking glow. The Water Cream transforms to release a burst of skin-improving nutrients, powerful Japanese botanicals, and refreshing hydration for clear, poreless skin that is perfectly prepped for makeup. This team makes the perfect jet-set companions, especially for those with oily or combination skin.",Skin Care Packs,
GOOP,GOOPGLOW Microderm Instant Glow Exfoliator,$200.00 ,VeganBrighteningExfoliatingFades pigmentationSulphate-freeParaben-free,Dual-action exfoliation that brightens.,https://www.mecca.com.au/on/demandware.static/-/Sites-mecca-online-catalog/default/dw3562ff2b/product/goopbe/hr/i-047483-goopglow-microderm-instant-glow-exfoliator-50ml-1-940.jpg,"Aqua, alumina, glycerin, cetearyl alcohol, glycolic acid, hydrated silica, limnanthes alba (meadowfoam) seed oil, squalane, glyceryl stearate, cetearyl olivate, sodium hydroxide, sorbitan olivate, garnet powder, quartz, ascorbic acid, terminalia ferdinandiana fruit extract, zizyphus jujuba seed extract, terminalia ferdinandiana seed oil, olea europaea (olive) leaf extract, carthamus tinctorius (safflower) seed oil, citrus aurantifolia (lime) oil, citrus aurantium dulcis (orange) peel oil, citrus limon (lemon) peel oil, citrus nobilis (mandarin orange) oil, lavendula hybrida oil, vetiveria zizanoides root oil, butyrospermum parkii (shea) butter, glyceryl caprylate, sodium stearoyl glutamate, citric acid, phenethyl alcohol, xylitol, caprylic acid, caprylhydroxamic acid, galactoarabinan, decyl glucoside, levan, dehydroxanthan gum, caprylyl glycol, citral, and limonene","Enjoy a physical and chemical exfoliation when you dip into this air-whipped dual-action microdermabrasion treatment. Designed to polish skin, smooth uneven texture, and reveal a healthy-looking, glowing complexion, the formula is densely packed with a blend of four powerful micro-exfoliating minerals (quartz, garnet, alumina, and silica). Rounding out this mix, glycolic acid has been included to help sweep away dry, dead skin cells and refine the appearance of pores for skin that is visibly softer, smoother, and more radiant.",Treatment,Scrubs & Exfoliators
Kylie Skin,Walnut Face Scrub,$38.00 ,VeganSulphate-freeParaben-free,"A gentle, non-abrasive facial exfoliant.",https://www.mecca.com.au/on/demandware.static/-/Sites-mecca-online-catalog/default/dwd67c3258/product/kylies/hr/i-047478-kylie-skin-walnut-face-scrub-1-940.jpg,"Water/aqua/eau, juglans regia (walnut) shell powder, cetyl alcohol, isopropyl palmitate, sodium cocoyl isethionate, glyceryl stearate, peg-100 stearate, cetearyl alcohol, glycerin, squalane, polysorbate 60, phenoxyethanol, acrylates/c10-30 alkyl acrylate crosspolymer, panthenol, aminomethyl propanol, chlorphenesin, allantoin, prunus armeniaca (apricot) kernel oil, simmondsia chinensis (jojoba) seed oil, xanthan gum, panax ginseng root extract, vaccinium myrtillus fruit extract, hydrolyzed viola tricolor extract, saccharum officinarum (sugarcane) extract, actinidia chinensis (kiwi) seed oil, citrus aurantium dulcis (orange) fruit extract, citrus limon (lemon) fruit extract, acer saccharum (sugar maple) extract, ethylhexylglycerin, sodium hyaluronate","Packed with fine, non-abrasive walnut powder and a blend of fruit extracts, a natural source of alpha-hydroxy acids (AHAs), this vegan exfoliant scrubs dead, dull skin away and leaves your complexion fresh and prepped for skincare. Brimming with squalane, glycerin, sodium hyaluronate and ginseng this scrub also strengthens, hydrates and energises skin while it works. Skin is left soft, moisturised and radiant.",Treatment,Scrubs & Exfoliators
Kylie Skin,Hydrating Face Mask,$58.00 ,VeganSulphate-freeParaben-free,"An antioxidant-rich, skin-brightening mask",https://www.mecca.com.au/on/demandware.static/-/Sites-mecca-online-catalog/default/dw8dde93b3/product/kylies/hr/i-047482-kylie-skin-hydrating-face-mask-1-940.jpg,"Water/Aqua/Eau, Caprylic/Capric Triglyceride, Cetearyl Alcohol, Niacinamide, Diheptyl Succinate, Isopentyldiol, Glycerin, Sorbitan Stearate, Hydroxyethyl Acrylate/Sodium Acryloyldimethyl Taurate Copolymer, Butyrospermum Parkii (Shea) Butter, Glyceryl Stearate, PEG-100 Stearate, Phenoxyethanol, Oryza Sativa (Rice) Bran Extract, Actinidia Chinensis (Kiwi) Seed Oil, Tocopheryl Acetate, Arginine HCl, Ethylhexylglycerin, Capryloyl Glycerin/Sebacic Acid Copolymer, Tetrahexyldecyl Ascorbate, Citric Acid, Chlorphenesin, Helianthus Annuus (Sunflower) Extract, Tetrasodium Glutamate Diacetate, Sorbitan Isostearate, Avena Sativa (Oat) Kernel Extract, Tocopherol, Rosmarinus Officinalis (Rosemary) Leaf Extract, Butylene Glycol, Aesculus Hippocastanum (Horse Chestnut) Seed Extract, Sodium Lauroyl Lactylate, Ceramide NP, Sodium Hyaluronate, Ceramide AP, Phytosphingosine, Cholesterol, Xanthan Gum, Carbomer, Ceramide EOP","Formulated antioxidants and vitamins, this creamy formula helps moisturise and soothe while improving the look and feel of your skin. Shea butter, ceramides, vitamin E and niacinamide, a brightening vitamin, have been included to ensure every time you swipe this mask on your skin is treated to a dose of nourishing ingredients. ",Treatment,Masks
The MECCA Edit,Skin Indulgence,$160.00 ,,Exclusive edit of MECCA favourites.,https://www.mecca.com.au/on/demandware.static/-/Sites-mecca-online-catalog/default/dwe0229d09/product/edit/hr/i-046156-skin-indulgence-1-940.jpg,"Prunus amygdalus dulcis (sweet almond) oil, caprylic/capric triglyceride, peg-6 caprylic/capric glycerides, peg-8 beeswax, cetearyl alcohol, sorbitan stearate, sambucus nigra (elderberry) seed oil, peg-60 almond glycerides, silica, avena sativa (oat) kernel oil, triticum vulgare (wheat) germ oil, butyrospermum parkii (shea) butter, citrus aurantium dulcis (orange) peel cera (wax), glycerin, lecithin, padina pavonica thallus extract, borago officinalis (starflower) seed oil, lavandula angustifolia (lavender) oil, phenoxyethanol, linalool, acacia decurrens (mimosa) flower wax, cocos nucifera (coconut) oil, rosa multiflora (rose) flower cera (wax), lavandula hybrida (lavandin) oil, pelargonium graveolens (geranium) flower oil, geraniol, eucalyptus globulus leaf oil, tocopherol, anthemis nobilis (chamomile) flower oil, citronellol, cinnamomum camphora (ho wood) wood oil, limonene, mentha arvensis (mint) leaf oil, simmondsia chinensis (jojoba) seed oil, citrus aurantium dulcis (orange) oil, fragrance (parfum), vitis vinifera (grape) seed oil, menthol, eugenia caryophyllus (clove) leaf oil, citric acid, Water/aqua/eau, glycerin, dimethicone, polysorbate 60, cetyl palmitate, propanediol, hydrogenated polydecene, sorbit stearate, squalane, imperata cylindrica, root extract, butylene glycol, tridecyl stearate, cucumis sativus (cucumber) fruit extract, actinidia chinensis (kiwi) fruit extract, cyathea medullaris leaf extract, salicornia herbacea extract, lavandula stoechas extract, hyaluronic acid, tridecyl trimellitate, tocopheryl acetate, dipentaerythrityl hexacapylate/hexacaprate, panthenol, acrylates/c10-30 alkyl acrylate crosspolymer, caprylic/capric triglyceride, ethylhexylglycerin, dimethiconol, glyceryl caprylate, hydrogenated vegetable oil, trideceth-6, sodium polyacrylate, caprylyl glycol, sodium hydroxide, ethylhexyl stearate, carbomer, tetrasodium edta, sodium benzoate, chlorphenesin, fragrance (parfum), alpha-isomethyl ionone, limonene, butylphenyl methylpropional, hexyl cinnamal, linalool, hydroxyisohexyl 3-cyclohexene carboxaldehyde, hydroxycitronellal, citronellol, benzyl benzoate, citral, yellow 5 (ci 19140), blue 1 (ci 42090), Squalane, oryza sativa (rice) bran wax, cera alba/beeswax/cire d  abeille, saccharomyces/camellia sinensis leaf/cladosiphon okamuranus/rice ferment filtrate, melissa officinalis leaf extract, betaphycus gelatinum extract, sodium hyaluronate, tocopherol, aqua/water/eau, pentylene glycol, butylene glycol, propanediol, ethylhexylglycerin, phenoxyethanol, Aqua (hungarian thermal water), glycerin, polysorbate 20, phenoxyethanol, pyrus malus (apple) fruit extract, saccharomyces (hungarian thermal water) ferment extract, disodium edta, ethylhexylglycerin, mannitol, malpighia punicifolia (acerola) fruit extract, chlorella vulgaris/lupinus albus protein ferment, pectin, rosa damascena flower water, citrus aurantium dulcis (orange) flower water, salvia officinalis (sage) leaf water, phospholipids, yeast extract, linalool, geraniol, citronellol, Aqua / water / eau, glycerin, dipropylene glycol, benzyl glycol, carrageenan, ceratonia siliqua gum, xanthan gum, cellulose gum, peg-60 hydrogenated castor oil, allantoin, butylene glycol, synthetic fluorphlogopite, prunus armeniaca (apricot / abricot) kernel oil, panthenol, trehalose, niacinamide, citrus paradisi (grapefruit / pamplemousse) fruit extract, alcohol, centella asiatica extract, glycyrrhiza glabra (liquorice / r glisse) root extract, agar, cyamopsis tetragonoloba gum, raspberry ketone, adenosine, calcium lactate, disodium edta, potassium chloride, glucose, tocopheryl acetate, phenoxyethanol, sodium hyaluronate, 1,2-hexanediol, pullulan, hydroxypropyl methylcellulose, porphyridium cruentum extract, rosa damascena (rose) extract, hydrolyzed collagen, ethylhexylglycerin, silk amino acids, glycine soja (soybean / soja) oil, sodium oleate, colloidal gold, hydrogenated lecithin, acetyl hexapeptide-8, fragrance / parfum, ci 77891 / titanium dioxide, ci 77491 / iron oxide","Give your skin the attention it deserves with this set of essentials that cleanse, hydrate, nourish and brighten. Your skin will thank you for it. ",Skin Care Packs,
