brand,product,price,benefits,oneliner,img,ingredients,description,category,sub-category
GOOP,GOOPGENES All-In-One Nourishing Face Cream,$152.00 ,VeganHydratingBrighteningExfoliatingFirmingSulphate-freeParaben-free,"A nourishing, botanical-rich daily moisturiser.",https://www.mecca.com.au/on/demandware.static/-/Sites-mecca-online-catalog/default/dw205daad7/product/goopbe/hr/i-047494-goopgenes-all-in-one-nourishing-face-cream-1-940.jpg,"Water/aqua/eau, glycerin, shorea stenoptera seed butter, squalane, cetyl lactate, oleyl alcohol, vegetable oil (olus oil), dicaprylyl ether, propanediol, c12-16 alcohols, glyceryl stearate citrate, palmitic acid, simmondsia chinensis (jojoba) seed oil, hydrogenated lecithin, schisandra chinensis fruit extract, glycosphingolipids, glycolipids, oryza sativa (rice) bran extract, bidens pilosa extract, gossypium herbaceum seed oil, punica granatum flower extract, polyglyceryl-3 diisosterate, astrocaryum murumuru (palm) seed butter, linum usitatissimum (linseed) seed extract, polygonum aviculare (knotweed) extract, helianthus annuus (sunflower) extract, microcitrus australascica fruit extract, rosmarinus officinalis (rosemary) leaf extract, tocopherol, ribose, diheptyl succinate, capryloyl glycerin/sebacic acid copolymer, xanthan gum, ethylhexylglycerin, caprylhydroxamic acid, benzyl alcohol, potassium sorbate, tetrasodium glutamate diacetate, sodium hydroxide, sodium citrate","Dubbed an  all-in-one supercream  by Goop, this formula significantly improves firmness, elasticity, glow, the appearance of fine lines and wrinkles, and brightness after just four weeks. The unique whipped texture melts into skin and a single application leaves skin deeply nourished, firmer-looking, and moisturised for 48 hours. The clinically-tested formula is made with a megadose of plant-based ceramides, squalane, and seven highly active botanicals including schisandra fruit, illipe butter, and caviar lime that work synergistically to leave skin moisturised, soft, supple, smooth, firm, and even-toned. ",Moisturiser,Moisturiser
The Beauty Chef,GLOW Inner Beauty Essential Supercharged Formula,$65.00 ,Vegan,A skin and gut-supporting beauty powder.,https://www.mecca.com.au/on/demandware.static/-/Sites-mecca-online-catalog/default/dw11a86f94/product/thebea/hr/i-045399-glow-inner-beauty-essential-supercharged-formula-150g-1-940.jpg,"turmeric powder, buckwheat, millet, quinoa, lemon juice, sea minerals,  anthocyanins (from black carrot), dunaliella salina (1.3%), linseed, pepitas, sunflower seeds, maqui berry powder (0.7%), molasses, agave, ginger powder), guar galactomannan (4.8%), anthocyanins (from black carrot and grape skins), natural wild berry flavour, biologically active vitamin b complex from quinoa sprouts (panmol ) (2.5%), pomegranate fruit peel extract (1.9%), citric acid,  zinc ascorbate, stevia leaf extract, saccharomyces boulardii, natural beta carotene (0.4%), lactobacillus rhamnosus gut5y  (0.14%), kakadu plum","Brimming with 18 Certified Organic wholefoods including bio-fermented maqui berries, queen garnet plum and pomegranate fruit peel extract, this potent berry-flavoured probiotic supplement promises to supercharge your beauty regimen. The formula also boasts vitamin C to help boost collagen production and zinc to support healthy hair and nails while promoting resilient, luminous skin from the inside out thanks to provitamin A, broad-spectrum B vitamins and more probiotics and postbiotics^ courtesy of The Beauty Chef s more potent fermentation process. It s the boost your gut and skin have been waiting for.",Supplements,
The MECCA Edit,The Double Cleanse,$60.00 ,,A made-for you set featuring two face cleansers.,https://www.mecca.com.au/on/demandware.static/-/Sites-mecca-online-catalog/default/dw7a3ef190/product/edit/hr/i-046155-double-cleansing-1-940.jpg,"Paraffinum Liquidum, Peg-30 Lanolin, Cetearyl Alcohol, Bis-Diglyceryl Polyacyladipate-2, Aluminum Stearate, Theobroma Cacao (Cocoa) Seed Butter, Peg-75 Lanolin, Phenoxyethanol, Chamomilla Recutita (Matricaria) Flower Oil, Eucalyptus Globulus Leaf Oil, Eugenia Caryophyllus (Clove) Leaf Oil, Humulus Lupulus (Hops) Cone Oil, Bht, Eugenol, Limonene, Vitis Vinifera Seed Oil, Glycerin, Caprylic/Capric Triglyceride, Aqua (Water), Sucrose Laurate, Limnanthes Alba Seed Oil, Parfum (Fragrance), Helianthus Annuus (Sunflower) Seed Oil Unsaponifiables, Sucrose Stearate, Sucrose Palmitate, Limonene, Linalool","Everything you need to melt away makeup, SPF, excess oil and dirt can be found in this exclusive made-for you set. ",Skin Care Packs,
The Beauty Chef,COLLAGEN Inner Beauty Boost Supercharged ,$45.00 ,Vegan,A collagen and gut-supporting vegan concentrate.,https://www.mecca.com.au/on/demandware.static/-/Sites-mecca-online-catalog/default/dw1057338c/product/thebea/hr/i-045359-collagen-inner-beauty-boost-supercharged-500ml-1-940.jpg,"papaya fruit and leaf extract, blueberry powder, acai powder, goji berry powder, maqui berry powder, pomegranate extract, grape seed extract, lactobacillus acidophilus, l. casei, l. plantarum, l. bulgaricus, l. fermentum, bifidobacterium lactis, b. bifidum, saccharomyces cerevisiae (93%), zinc gluconate, stabiliser (glycerol) (derived from sustainable palm), ascorbic acid","This berry-flavoured concentrate is a nourishing and glow-boosting elixir crafted to support and protect your natural collagen and elastin while preserving the skin s structural proteins and protecting against free radical damage. Brimming with bio-fermented goji berry, grape seed extract, zinc and vitamin C, it s designed for those concerned with fine lines and premature ageing. This formula will slot seamlessly into your current beauty regimen and has been supercharged using The Beauty Chef's unique Flora Culture  fermentation process. The Collagen Inner Beauty Boost is fermented with a natural broad-spectrum probiotic to feed the beneficial bacteria in your gut because a healthy microbiome is the secret to radiant skin.",Supplements,
Dermalogica,Micro-Pore Mist,$32.00 ,VeganAnti-blemishDe-congestingExfoliatingPore minimisingOil freeParaben-free,"Pore minimizing, oil controlling mist.",https://www.mecca.com.au/on/demandware.static/-/Sites-mecca-online-catalog/default/dw849a4496/product/dermal/hr/i-046179-micro-pore-mist-1-940.jpg,"Water/ aqua/eau, niacinamide, hamamelis virginiana (witch hazel) extract, glycerin, lactobacillus ferment, butylene glycol, lactobacillus, polysorbate 20, panthenol, potassium sorbate, citric acid, cocos nucifera (coconut) fruit extract, dipotassium glycyrrhizate, cucumis sativus (cucumber) fruit extract, camellia oleifera (green tea) leaf extract, chamomilla recutita (matricaria) flower extract, rosa canina (rose hips) fruit extract, hydrolyzed hyaluronic acid, sodium hyaluronate, hexyl cinnamal, benzyl salicylate, citronellol","A vegan, do-it-all face mist that works to minimise the appearance of pores, reduces excess oil and helps to diminish the appearance of post-acne marks. Formulated with niacinamide, witch hazel, green tea and more, this antioxidant-rich blend will leave your skin looking and feeling clearer from the first spritz. ",Cleanser & Toner,Toner
The MECCA Edit,The Anti-Ageing Duo,$88.00 ,,Duo of Shiseido favourites for healthy skin.,https://www.mecca.com.au/on/demandware.static/-/Sites-mecca-online-catalog/default/dw4bb05f55/product/edit/hr/i-046163-the-anti-ageing-duo-1-940.jpg,"Water, alcohol, dipropylene glycol, glycerin, dimethicone, xylitol, diphenylsiloxy phenyl trimethicone, trehalose, cetyl ethylhexanoate, peg-60 glyceryl isostearate, silica, potassium methoxysalicylate, peg-5 glyceryl stearate, behenyl alcohol, phenoxyethanol, carbomer, butylene glycol, batyl alcohol, potassium hydroxide, tocopheryl acetate, peg/ppg-17/4 dimethyl ether, phytosteryl/octyldodecyl lauroyl glutamate, phytosteryl macadamiate, disodium edta, fragrance, xanthan gum, sodium metaphosphate, dipotassium glycyrrhizate, sodium metabisulfite, iron oxides 77492, angelica acutiloba root extract, olea europaea (olive) leaf extract, sodium acetylated hyaluronate, camellia sinensis leaf extract, iron oxides 77491, bupleurum falcatum root extract, royal jelly extract 0.00022000, tocopherol 0.00016000, paeonia suffruticosa root extract 0.00015000, thymus serpillum extract 0.00015000, panax ginseng root extract 0.00003000, Water, pentaerythrityl tetraethylhexanoate, butylene glycol, diphenylsiloxy phenyl trimethicone, glycerin, dipropylene glycol, potassium methoxysalicylate, peg-60 hydrogenated castor oil, phenoxyethanol, methylparaben, xanthan gum, carbomer, tocopheryl acetate, trisodium edta, sodium citrate, potassium hydroxide, bht, mineral oil, alcohol, retinol, polysorbate 20, citric acid, fragrance, angelica acutiloba root extract, olea europaea (olive) leaf extract, camellia sinensis leaf extract, bupleurum falcatum root extract","Target the appearance of fine lines, dullness and give skin a healthy serve of hydration with this innovative set including two of Shiseido's best.",Skin Care Packs,
LA MER,The Restorative Hydration Collection,$800.00 ,HydratingParaben-free,A duo of La Mer best sellers.,https://www.mecca.com.au/on/demandware.static/-/Sites-mecca-online-catalog/default/dw8e612632/product/lamer/hr/i-045627-the-restorative-hydration-collection-1-940.jpg,"Cyclopentasiloxane, algae extract, glycerin, dimethicone, polysilicone-11, isononyl isononanoate, dimethicone/peg-10/15 crosspolymer, cyclohexasiloxane, sesamum indicum (sesame) seed oil, medicago sativa (alfalfa) seed powder, helianthus annuus (sunflower) seedcake, prunus amygdalus dulcis (sweet almond) seed meal, eucalyptus globulus (eucalyptus) leaf oil, sodium gluconate, copper gluconate, calcium gluconate, magnesium gluconate, zinc gluconate, tocopheryl succinate, niacin, sesamum indicum (sesame) seed powder, water/aqua/eau, dimethicone crosspolymer, helichrysum arenarium (everlasting) extract, laminaria ochroleuca extract, triticum vulgare (wheat) flour lipids, citrus aurantifolia (lime) peel extract, crithmum maritimum extract, alteromonas ferment extract, chlorella vulgaris extract, yeast extract/faex/extrait de levure, cholesterol, linoleic acid, tocopherol, tetraacetylphytosphingosine, caprylic/capric triglyceride, rosmarinus officinalis (rosemary) leaf oil, ocimum basilicum (basil) oil, lavandula angustifolia (lavender) oil, lavandula hybrida (lavandin) oil, dipropylene glycol, alcohol denat., sodium citrate, eugenol, limonene, linalool, bht, phenoxyethanol, potassium sorbate, Seaweed (algae) extract , mineral oil/paraffinum liquidum/huile minerale , petrolatum , glycerin , isohexadecane , citrus aurantifolia (lime) extract , microcrystalline wax /cera microcristallina/cire microcristalline , lanolin alcohol , sesamum indicum (sesame) seed oil , eucalyptus globulus (ecalyptus) leaf oil , magnesium sulfate , sesamum indicum (sesame) seed , medicago sativa (alfalfa) seed powder , helianthus annuus (sunflower) seedcake , prunus amygdalus dulcis (sweet almond) seed meal , sodium gluconate , potassium gluconate , copper gluconate , calcium gluconate , magnesium gluconate , zinc gluconate , paraffin , tocopheryl succinate , niacin , beta-carotene , decyl oleate , aluminum distearate , octyldodecanol , citric acid , cyanocobalamin , magnesium stearate , panthenol , limonene , geraniol , linalool , hydroxycitronellal , citronellol , benzyl salicylate , citral , methylchloroisothiazolinone , methylisothiazolinone , alcohol denat. , fragrance (parfum)","This limited-edition set features two of La Mers bestsellers. The Concentrate helps to improve the appearance of redness and irritation in the skin, whilst Cr me de la Mer deeply nourishes and hydrates. Both products are housed in a luxe bag, gift-ready for a loved one to enjoy (or yourself). ",Skin Care Packs,
111SKIN,Master Masking Planner,$168.00 ,Paraben-free,The ultimate face and eye treatment mask set.,https://www.mecca.com.au/on/demandware.static/-/Sites-mecca-online-catalog/default/dw684f1699/product/1skin/hr/i-045532-the-master-masking-planner-1-940.jpg,"Aqua / water / eau, glycerin, dipropylene glycol, benzyl glycol, carrageenan, ceratonia siliqua gum, xanthan gum, peg-60 hydrogenated castor oil, allantoin, ethylhexylglycerin, agar, cyamopsis tetragonoloba (guar) gum, synthetic fluorphlogopite, raspberry ketone, calcium lactate, potassium chloride, glucose, tocopheryl acetate, disodium edta, mica, butylene glycol, caprylic/capric triglyceride, titanium/titanium dioxide, ubiquinone, hydrogenated lecithin, undaria pinnatifida (wakame / wakam ) extract, hydrolysed collagen, phenoxyethanol, corallina officinalis extract, sodium benzoate, potassium sorbate, acetyl tetrapeptide-5, fragrance / parfum, ci 77891 / titanium dioxide, ci 77007 / ultramarines, ci 77861 / tin oxide, Aqua / water / eau, glycerin, dipropylene glycol, carrageenan, benzyl glycol, ceratonia siliqua gum, peg-60 hydrogenated castor oil, xanthan gum, allantoin, titanium/titanium dioxide, niacinamide,  rosa canina (rosehip / cynorhodon) fruit extract, citrus paradisi (grapefruit / pamplemousse) fruit extract, ethylhexylglycerin, acacia senegal gum, tocopheryl acetate, ricinus communis (castor) seed oil, dipotassium glycyrrhizate, raspberry ketone, adenosine, synthetic fluorphlogopite, disodium edta, butylene glycol, calcium lactate, caprylic/capric triglyceride, macadamia ternifolia seed oil, peat water, hydrogenated lecithin, propylene glycol, polysorbate 20, retinol, 1,2-hexanediol, cholesterol, hydroxypropyl methylcellulose, citric acid, phenoxyethanol, peg-5 rapeseed sterol, brassica campestris (rapeseed / colza) sterol, silica, sodium hyaluronate, ceteth-3, ceteth-5, hydrolysed , potassium cetyl phosphate, potassium sorbate, diamond powder, fragrance / parfum, ci 77499 / iron oxides, ci 77891 / titanium dioxide, Aqua / eau / water, glycerin, pentylene glycol, trehalose, dipropylene glycol, propylene glycol, sodium levulinate, panthenol, citrus grandis (grapefruit / pamplemousse) fruit extract, sodium anisate, hydroxyethylcellulose, peg-60 hydrogenated castor oil, rosmarinus officinalis (rosemary / romarin) flower / leaf / stem water, sodium hyaluronate, phenoxyethanol, leuconostoc/radish root ferment lysate filtrate, lactic acid, propanediol, epilobium fleischeri (rosebay / rhododendron) extract, epilobium angustifolium flower / leaf / stem extract, melaleuca alternifolia (tea tree / arbre   th ) leaf oil, chlorella vulgaris extract, potassium sorbate, citric acid, sodium metabisulfite, fragrance / parfum, Water, glycerin, pentylene glycol, trehalose, dipropylene glycol, sodium levulinate, panthenol, aloe barbadensis leaf juice, propanediol, sodium anisate, hydroxyethylcellulose, peg-60 hydrogenated castor oil, rosmarinus officinalis (rosemary / romarin) flower / leaf / stem water, mannitol, sodium hyaluronate, phenoxyethanol, lactic acid, butylene glycol, 1,2-hexanediol, sodium citrate, melaleuca alternifolia (tea tree / arbre   th ) leaf oil, plankton extract, hydroxycinnamic acid, rutin, chlorella vulgaris extract, lecithin, sodium ascorbate, benzyl alcohol, acetyl tetrapeptide-15, dehydroacetic acid, tocopherol, fragrance / parfum, Aqua / water / eau, glycerin, dipropylene glycol, benzyl glycol, carrageenan, ceratonia siliqua gum, xanthan gum, cellulose gum, peg-60 hydrogenated castor oil, allantoin, butylene glycol, synthetic fluorphlogopite, prunus armeniaca (apricot / abricot) kernel oil, panthenol, trehalose, niacinamide, citrus paradisi (grapefruit / pamplemousse) fruit extract, alcohol, centella asiatica extract, glycyrrhiza glabra (liquorice / r glisse) root extract, agar, cyamopsis tetragonoloba (guar) gum, raspberry ketone, adenosine, calcium lactate, disodium edta, potassium chloride, glucose, tocopheryl acetate, phenoxyethanol, sodium hyaluronate, 1,2-hexanediol, pullulan, hydroxypropyl methylcellulose, porphyridium cruentum (red algae / algue rouge) extract, rosa damascena (rose) extract, hydrolysed collagen, ethylhexylglycerin, silk amino acids, glycine soja (soybean / soja) oil, sodium oleate, colloidal gold, hydrogenated lecithin, acetyl hexapeptide-8, fragrance / parfum, ci 77891 / titanium dioxide, ci 77491 / iron oxides, Aqua / water / eau, glycerin, butylene glycol, mannitol, ammonium glycyrrhizate, trehalose, alcohol, ectoin, panthenol, peg-60 hydrogenated castor oil, phenoxyethanol, caffeine, carbomer, zinc gluconate, magnesium ascorbyl phosphate, butyrospermum parkii (shea / karit ) butter, potassium hydroxide, aesculus hippocastanum (horse chestnut / marron) seed extract, citrus paradisi (grapefruit / pamplemousse) fruit extract, ethylhexylglycerin, allantoin, disodium edta, hydrogenated lecithin, prunus armeniaca (apricot / abricot) kernel oil, phenethyl alcohol, centella asiatica leaf extract, acetyl cysteine, glycyrrhiza glabra (liquorice / r glisse) root extract, silk amino acids, maltodextrin, pentapeptide-59, benzyl alcohol, potassium sorbate, sodium benzoate, fragrance / parfum, Aqua / water / eau, glycerin, dipropylene glycol, benzyl glycol, chondrus crispus powder, ceratonia siliqua (carob / caroube) gum, xanthan gum, cellulose gum, peg-60 hydrogenated castor oil, allantoin, caffeine, ethylhexylglycerin, cyamopsis tetragonoloba (guar) gum, agar, synthetic fluorphlogopite, raspberry ketone, calcium lactate, tocopheryl acetate, glucose, potassium chloride, disodium edta, mica, caprylic / capric triglyceride, titanium / titanium dioxide, butylene glycol, 1,2-hexanediol, ubiquinone, hydrolyzed collagen, hydrogenated lecithin, sodium hyaluronate, glucosyl hesperidin, undaria pinnatifida extract, sodium phosphate, corallina officinalis extract, caprylyl glycol, sodium benzoate, nonapeptide-1, acetyl tetrapeptide-5, potassium sorbate, disodium phosphate, fragrance / parfum, ci 77891 / titanium dioxide, ci 77007 / ultramarines, ci 77861 / tin oxide","The ultimate gift or travel companion for every skincare concern. The Master-Masking Planner features an array of 111Skin s most iconic and potent facial treatment masks. A mix of hydrogel and bio cellulose sheet masks help to firm, hydrate, clarify and brighten. The appearance of fine lines, wrinkles and redness is reduced, with the skin barrier function reinforced. ",Skin Care Packs,
LA MER,The Rejuvenating Hydration Collection,$150.00 ,Paraben-free,Set featuring hand and lip treatment.,https://www.mecca.com.au/on/demandware.static/-/Sites-mecca-online-catalog/default/dw76b58ee2/product/lamer/hr/i-045626-the-rejuvenating-hydration-collection-1-940.jpg,"Petrolatum, triisostearyl citrate, polyglyceryl-2 triisostearate, polybutene, octyldodecanol, polyglyceryl-10 pentaoleate, microcrystalline wax/cera microcristallina/cire microcristalline, cetyl peg/ppg-10/1 dimethicone, ethylene/propylene/styrene copolymer, algae (seaweed) extract, ppg-51/smdi copolymer, butyrospermum parkii (shea butter), tocopheryl acetate, sodium hyaluronate, cucumis sativus (cucumber) fruit extract, sesamum indicum (sesame) seed oil, eucalyptus globulus (eucalyptus) leaf oil, medicago sativa (alfalfa) seed powder, sesamum indicum (sesame) seed powder, prunus amygdalus dulcis (sweet almond) seed meal, hordeum vulgare (barley) extract/extrait d'orge, salicornia herbacea extract, helianthus annuus (sunflower) seedcake, olea europaea (olive) fruit oil, citrus aurantifolia (lime) peel extract, helianthus annuus (sunflower) seed wax, persea gratissima (avocado) oil, ricinus communis (castor) seed oil, theobroma grandiflorum seed butter, cocos nucifera (coconut) oil, astrocaryum murumuru seed butter, niacin, magnesium gluconate, zinc gluconate, calcium gluconate, copper gluconate, sodium gluconate, palmitoyl tripeptide-1, tourmaline, malachite, phytosphingosine, menthyl pca, phytosterols, tribehenin, glycerin, acetyl glucosamine, cholesterol, caprylic/capric triglyceride, menthoxypropanediol, ethylhexyl palmitate, simethicone, calcium aluminum borosilicate, calcium sodium borosilicate, synthetic fluorphlogopite, aluminum calcium sodium silicate, calcium carbonate, silica, tin oxide, water/aqua/eau, butylene/ethylene/styrene copolymer, titanium/titanium dioxide, polyethylene terephthalate, propylene glycol dicaprate, palmitic acid, oleic acid, ethylhexyl hydroxystearate, sorbitan isostearate, glyceryl distearate, alcohol denat., hydrogenated castor oil, flavor (aroma), linalool, limonene, benzyl benzoate, sodium saccharin, bht, tocopheryl succinate, tetrahexyldecyl ascorbate, alumina, acrylates copolymer,  [+/- mica, titanium dioxide (ci 77891), iron oxides (ci 77492), iron oxides (ci 77491), iron oxides (ci 77499), bismuth oxychloride (ci 77163), blue 1 lake (ci 42090), bronze powder (ci 77400), carmine (ci 75470), copper powder (ci 77400), red 6 (ci 15850), red 21 (ci 45380), red 27 (ci 45410), red 7 lake (ci 15850), red 28 lake (ci 45410), red 30 lake (ci 73360), red 33 lake (ci 17200), yellow 5 (ci 19140), yellow 6 (ci 15985), yellow 5 lake (ci 19140), yellow 6 lake (ci 15985)], Declustered water (-)/aqua/eau de-structuree (-) , declustered water (+)/aqua/eau de-structuree (+) , limnanthes alba (meadowfoam) seed oil , caprylic/capric triglyceride , cetyl alcohol , stearyl alcohol , dimethicone , glycerin , pentylene glycol , glyceryl stearate , coco-caprylate/caprate , tourmaline , triticum vulgare (wheat) germ extract , vitis vinifera (grape) fruit extract , hordeum vulgare (barley) extract/extrait d'orge , saccharomyces/copper ferment , caprylyl glycol , scutellaria baicalensis root extract , pantethine , cholesterol , ginkgo biloba leaf extract , algae (seaweed) extract , sesamum indicum (sesame) seed oil , medicago sativa (alfalfa) seed powder , helianthus annuus (sunflower) seedcake , prunus amygdalus dulcis (sweet almond) seed meal , eucalyptus globulus (eucalyptus) leaf oil , sodium gluconate , copper gluconate , calcium gluconate , magnesium gluconate , zinc gluconate , tocopheryl succinate , niacin , sesamum indicum (sesame) seed powder , glyceryl triacetyl ricinoleate , macadamia integrifolia seed oil , hexylene glycol , triethylhexanoin , bisabolol , linoleic acid , sodium hyaluronate , caffeine , morus nigra (mulberry) root extract , tocopheryl acetate , squalane , methyl glucose sesquistearate , tocopheryl nicotinate , crithmum maritimum extract , butylene glycol , magnesium sulfate , peg-100 stearate , xanthan gum , fragrance (parfum) , limonene , linalool , amyl cinnamal , hexyl cinnamal , benzyl benzoate , coumarin , citronellol , disodium edta , phenoxyethanol","A two-piece essentials set featuring La Mer's Lip Volumiser for plump, hydrated and nourished lips, and The Hand Treatment a rich, healing moisturiser that restores dry hands. Both products are housed in an artful bag, perfect for gifting. ",Skin Care Packs,
