brand,product,price,benefits,oneliner,img,ingredients,description,category,sub-category
Mario Badescu,"Facial Spray With Aloe, Cucumber And Green Tea",$19.00 ,HydratingBrightening,Cool and refresh with an antioxidant boost.,https://www.mecca.com.au/on/demandware.static/-/Sites-mecca-online-catalog/default/dw85ddd5c1/product/mario/hr/i-032369-facial-spray-cucumber-236ml-1-940.jpg,"Aqua (water, eau), propylene glycol, mentha piperita (peppermint) leaf water, cucumis sativus (cucumber) fruit water, aloe barbadensis leaf juice, camellia sinensis leaf extract, cucumis sativus (cucumber) fruit extract, fucus vesiculosus (bladderwrack) extract, propanediol, polysorbate 20, ethylhexylglycerin, benzophenone-4, parfum (fragrance), sodium chloride, citric acid, potassium sorbate, sodium benzoate, hexyl cinnamal, limonene, linalool, ci 19140 (yellow 5), ci 42090 (blue 1)","A nutrient-rich spritz that hydrates, cools and invigorates dull, tired skin. Use before moisturiser to tone, after makeup to add a dewy finish and throughout the day to re-energise the skin.",Cleanser & Toner,Toner
Mario Badescu,Dewy Skin Delights,$24.00 ,HydratingSulphate-freeAlcohol-free,Mini Mario Badescu must haves.,https://www.mecca.com.au/on/demandware.static/-/Sites-mecca-online-catalog/default/dw756c4d3e/product/mario/hr/i-045550-dewy-skin-delights-1-940.jpg,"Aqua (water, eau), glyceryl stearate, paraffinum liquidum (mineral oil, huile min rale), zea mays (corn) oil, tocopheryl acetate, propylene glycol, cetyl alcohol, triticum vulgare (wheat) germ oil, retinyl palmitate, glycerin, parfum (fragrance), triethanolamine, propylparaben, amyl cinnamal, benzyl alcohol, citronellol, eugenol, geraniol, hexyl cinnamal, isoeugenol, butylphenyl methylpropional, limonene, linalool, methyl 2-octynoate, alpha-isomethyl ionone, ci 77891 (titanium dioxide), Hydrogenated polydecene, cocoglycerides, ethylene/propylene/styrene copolymer, dimethicone, brassica glycerides, persea gratissima (avocado) oil, glyceryl behenate, microcrystalline cellulose, polyhydroxystearic acid, jojoba esters, helianthus annuus (sunflower) seed wax, theobroma cacao (cocoa) seed butter, prunus amygdalus dulcis (sweet almond) oil, silica silylate, silica, cera alba (beeswax, cire d abeille), chamomilla recutita (matricaria) flower extract, raspberry seed oil/tocopheryl succinate aminopropanediol esters, dimethicone crosspolymer, dimethicone/vinyl dimethicone crosspolymer, aloe barbadensis leaf extract, glyceryl rosinate, hydrogenated vegetable oil, olea europaea (olive) oil unsaponifiables, acacia decurrens flower cera, tocopherol, butylene/ethylene/styrene copolymer, candelilla cera (euphorbia cerifera (candelilla) wax, cire de candelilla), polysorbate 80, polyglycerin-3, linoleic acid, hydrolyzed corn starch, sucralose, aroma (flavor), linolenic acid, hydrated silica, pentaerythrityl tetra-di-t-butyl hydroxyhydrocinnamate, Aqua (water, eau), propylene glycol, aloe barbadensis leaf juice, rosa canina extract, thymus vulgaris (thyme) leaf extract, fucus vesiculosus (bladderwrack) extract, gardenia florida fruit extract, caprylyl glycol, hexylene glycol, polysorbate 20, parfum (fragrance), phenoxyethanol, sodium chloride, citronellol, geraniol, ci 17200 (red 33), ci 42090 (blue 1), Aqua (water, eau), aloe barbadensis leaf juice, pentylene glycol, neopentyl glycol diheptanoate, glycerin, isododecane, caprylic/capric glycerides, squalane, sodium hyaluronate, hydrolyzed sodium hyaluronate, camellia sinensis leaf extract, cucumis sativus (cucumber) extract, thymus vulgaris (thyme) extract, hydroxyethyl acrylate/sodium acryloyldimethyl taurate copolymer, silica, propylene glycol, phenoxyethanol, isohexadecane, polyacrylate-13, polyisobutene, ammonium acryloyldimethyltaurate/vp copolymer, chlorphenesin, caprylyl glycol, polysorbate 60, sorbitan isostearate, bht, polysorbate 20, citric acid, potassium sorbate, sodium benzoate","A collection of delightful minis, perfectly sized to store in your hand bag and take with you on-the-go. Included is the cult favourite Facial Spray with Aloe, Herbs and Rosewater 29 ml to refresh and reset, Special Hand Cream with Vitamin E 29 ml for silky-smooth hands, Lip Balm 10 g for petal-soft lips and Hyaluronic Dew Cream 10 g for your dewiest skin yet.",Skin Care Packs,
Eve Lom,Iconic Cleanse Ornament Set,$37.00 ,Paraben-free,An iconic cleansing duo.,https://www.mecca.com.au/on/demandware.static/-/Sites-mecca-online-catalog/default/dwd40582ae/product/evelom/hr/i-045533-iconic-cleanse-ornament-set-1-940.jpg,"paraffinum liquidum, peg-30 lanolin, cetearyl alcohol, bis-diglyceryl polyacyladipate-2, aluminum stearate, theobroma cacao (cocoa) seed butter, peg-75 lanolin, phenoxyethanol, chamomilla recutita (matricaria) flower oil, eucalyptus globulus leaf oil, eugenia caryophyllus (clove) leaf oil, humulus lupulus (hops) cone oil, bht, eugenol, limonene","Give the gift of radiant skin with this ornament-themed holiday set from Eve Lom. Featuring the iconic, award winning cleanser (20ml) described by Vogue as,  probably the best cleanser in the world  alongside a specially woven, travel size 100% cotton muslin cloth. This multi-benefit, 5-in-1 product deeply cleanses and removes even the most stubborn waterproof make-up, gently exfoliates, decongests, tones and improves circulation. Skin is left cleansed, nourished, smoothed and luminous.",Skin Care Packs,
Mario Badescu,"Facial Spray With Aloe, Herbs & Rosewater",$19.00 ,VeganHydratingBrightening,A hydrating spray for moisture and radiance.,https://www.mecca.com.au/on/demandware.static/-/Sites-mecca-online-catalog/default/dw1129086a/product/mario/hr/i-023967-facial-spray-with-aloe-herbs-rosewater-236-ml-1-940.jpg,"Aqua (water, eau), propylene glycol, aloe barbadensis leaf juice, rosa canina extract, thymus vulgaris (thyme) leaf extract, fucus vesiculosus (bladderwrack) extract, gardenia florida fruit extract, caprylyl glycol, hexylene glycol, polysorbate 20, parfum (fragrance), phenoxyethanol, sodium chloride, citronellol, geraniol, ci 17200 (red 33), ci 42090 (blue 1)","A refreshing facial spray that will instantly hydrate, add radiance and soothe stressed, tight skin. Mist over face before or after makeup to add a dewy finish, through the hair to hydrate brittle ends or to refresh skin throughout the day. Formulated with fragrant herbal extracts including rose, thyme and gardenia, this spritz can work as aromatherapy to also calm the mind. ",Cleanser & Toner,Toner
Eve Lom,Begin & End Gift Set,$302.00 ,HydratingBrighteningExfoliatingParaben-free,A hardworking cleansing and moisturising trio.,https://www.mecca.com.au/on/demandware.static/-/Sites-mecca-online-catalog/default/dw0916b654/product/evelom/hr/i-045535-begin-end-gift-set-1-940.jpg,"Aqua (water), caprylic/capric triglyceride, c12-15 alkyl benzoate, propanediol, glycerin, c12-16 alcohols, dimethicone, sodium acrylates crosspolymer-2, glyceryl stearate se, xylitylglucoside, betaine, palmitic acid, phenoxyethanol, anhydroxylitol, hydrogenated lecithin, crambe abyssinica seed oil, helianthus annuus (sunflower) seed oil, prunus persica (peach) flower extract, marrubium vulgare extract, polyacrylate crosspolymer-6, sodium acetylated hyaluronate, xylitol, ethylhexylglycerin, tocopheryl acetate, citric acid, disodium edta, lavandula angustifolia (lavender) oil, rosmarinus officinalis (rosemary) leaf extract, sodium benzoate, limonene, citrus limon (lemon) peel oil, coriandrum sativum (coriander) seed oil, cymbopogon nardus (citronella) oil, mentha piperita (peppermint) oil, citrus aurantium amara (bitter orange) peel oil, litsea cubeba fruit oil, mentha piperita (peppermint) leaf extract, pelargonium graveolens flower oil, pogostemon cablin leaf oil, anthemis nobilis flower oil, boswellia carterii oil, linalool, limonene, citral, geraniol","Give the gift of radiant, dewy skin with this three-piece holiday set from Eve Lom. Featuring the iconic, award winning Cleanser 200ml, alongside a specially woven, 100% cotton muslin cloth (full size) and the nourishing, anti-ageing Moisture Cream 50ml. This hardworking set cleanses and hydrates the complexion, gently exfoliates, decongests and soothes. Skin is left cleansed, nourished and radiant, the appearance of fine lines are diminished and hydration levels are increased for up to 72 hours! ",Skin Care Packs,
Mario Badescu,Mini Mist Collection,$32.00 ,VeganHydratingParaben-freeAlcohol-free,"Hydrate, refresh and reset.",https://www.mecca.com.au/on/demandware.static/-/Sites-mecca-online-catalog/default/dwe3a7b875/product/mario/hr/i-045549-mini-mist-collection-1-940.jpg,"Aqua (water, eau), propylene glycol, aloe barbadensis leaf juice, rosa canina extract, thymus vulgaris (thyme) leaf extract, fucus vesiculosus (bladderwrack) extract, gardenia florida fruit extract, caprylyl glycol, hexylene glycol, polysorbate 20, parfum (fragrance), phenoxyethanol, sodium chloride, citronellol, geraniol, ci 17200 (red 33), ci 42090 (blue 1), Aqua (water, eau), propylene glycol, mentha piperita (peppermint) leaf water, cucumis sativus (cucumber) fruit water, aloe barbadensis leaf juice, camellia sinensis leaf extract, cucumis sativus (cucumber) fruit extract, fucus vesiculosus (bladderwrack) extract, propanediol, polysorbate 20, ethylhexylglycerin, benzophenone-4, parfum (fragrance), sodium chloride, citric acid, potassium sorbate, sodium benzoate, hexyl cinnamal, limonene, linalool, ci 19140 (yellow 5), ci 42090 (blue 1), Aqua (water, eau), lavandula angustifolia (lavender) flower water, propylene glycol, polysorbate 20, aloe barbadensis leaf juice, lavandula angustifolia (lavender) oil, chamomilla recutita (matricaria) flower extract, fucus vesiculosus (bladderwrack) extract, 3-o-ethyl ascorbic acid, thymus vulgaris (thyme) leaf extract, potassium sorbate, sodium benzoate, benzophenone-4, triethanolamine, propanediol, sodium sulfate, citric acid, ethylhexylglycerin, sodium chloride, ci 60730 (violet 2), Aqua (water, eau), propylene glycol, salvia officinalis (sage) flower/leaf/stem water, citrus aurantium amara (bitter orange) flower water, thymus vulgaris (thyme) leaf extract, salvia officinalis (sage) leaf extract, aloe barbadensis leaf juice, fucus vesiculosus (bladderwrack) extract, propanediol, ethylhexylglycerin, benzophenone-4, parfum (fragrance), sodium chloride, citric acid, potassium sorbate, sodium benzoate, hexyl cinnamal, limonene, linalool, ci 19140 (yellow 5), ci 15985 (yellow 6), ci 16035 (red 40)","A collection of four bestselling Mario Badescu facial mists. This limited-edition set is just what skin needs to keep it hydrated, refreshed and glowing, simply match the mist to your mood. ",Skin Care Packs,
Omorovicza,Perfecting Duo,$94.00 ,HydratingBrighteningSulphate-freeParaben-freeAlcohol-free,Holiday ornament featuring Omorovicza favourites,https://www.mecca.com.au/on/demandware.static/-/Sites-mecca-online-catalog/default/dw44a8c279/product/omorovicza/hr/i-045640-perfecting-duo-1-940.jpg,"Aqua (hungarian thermal water), glycerin, polysorbate 20, phenoxyethanol, pyrus malus (apple) fruit extract, saccharomyces (hungarian thermal water) ferment extract, disodium edta, ethylhexylglycerin, mannitol, malpighia punicifolia (acerola) fruit extract, chlorella vulgaris/lupinus albus protein ferment, pectin, rosa damascena flower water, citrus aurantium dulcis (orange) flower water, salvia officinalis (sage) leaf water, phospholipids, yeast extract, linalool, geraniol, citronellol, Ricinus communis (castor) seed oil, diisostearoyl polyglyceryl-3 dimer dilinoleate, cera alba (beeswax), theobroma cacao (cocoa) seed butter, ethylhexyl palmitate, lanolin, butyrospermum parkii (shea) butter, prunus armeniaca (apricot) kernel oil, prunus domestica (plum) fruit extract, menthyl pca, helianthus annuus (sunflower) seed oil, benzyl alcohol, parfum (aroma (flavor)), safflower oil/palm oil aminopropanediol esters, tribehenin, calendula officinalis (calendula) flower extract, ascorbyl tetraisopalmitate, tocopherol, silica dimethyl silylate, aqua, dehydroacetic acid, phenoxyethanol, sodium saccharin, sorbitan isostearate, eucalyptus globulus (eucalyptus) leaf oil, mica, ci77891 (titanium dioxide), sodium hyaluronate, ci75470 (carmine), palmitoyl oligopeptide, citronellol, benzyl salyciate, limonene, linalool","A limited-edition holiday ornament featuring the Queen of Hungary Mist 50ml in gorgeous rose gold packaging, it instantly refreshes skin and lifts the spirits, and the Perfecting Lip Balm 10ml to smooth, hydrate and plump lips. ",Skin Care Packs,
Omorovicza,Mini Mud Set,$92.00 ,HydratingExfoliating,Ultimate trio for refreshed and glowing skin.,https://www.mecca.com.au/on/demandware.static/-/Sites-mecca-online-catalog/default/dwd577fde6/product/omorovicza/hr/i-045641-mini-mud-set-1-940.jpg,"Glycerin, silt (hungarian mud), copper gluconate, cetearyl olivate, lava powder, sorbitan olivate, sodium cocoyl glutamate, silica, aqua (water), phenoxyethanol, lactobionic acid, mangifera indica (mango) pulp extract, spondias mombin pulp extract, musa sapientum (banana) pulp extract, saccharomyces (hungarian thermal water) ferment extract, parfum (fragrance), xanthan gum, ethylhexylglycerin, aqua (hungarian thermal water), caprylic/capric triglyceride, phaeodactylum tricornutum extract, phospholipids, benzyl alcohol, potassium sorbate, tocopherol, linalool, limonene, citronellol, geraniol, Prunus amygdalus dulcis (sweet almond) oil, cetearyl ethylhexanoate, glyceryl stearate, silt (hungarian mud), cera alba (beeswax), squalane, stearyl heptanoate, cetearyl alcohol, prunus domestica (plum) seed extract, prunus armeniaca (apricot) kernel oil, sodium cocoyl glutamate, phenoxyethanol, parfum (fragrance), benzyl alcohol, ethylhexylglycerin, tocopherol, saccharomyces (hungarian thermal water) ferment extract, aqua (hungarian thermal water), malpighia punicifolia (acerola) fruit extract, aqua, dehydroacetic acid, phospholipids, linalool, limonene, Aqua (hungarian thermal water), kaolin, glycerin, cetearyl alcohol, silt (hungarian mud), stearic acid, cetearyl olivate, zinc oxide, phenoxyethanol, sorbitan olivate, mannitol, malpighia punicifolia (acerola) fruit extract, saccharomyces (hungarian thermal water) ferment extract, tocopherol, ethylhexylglycerin, sodium hydroxide, parfum (fragrance), yeast extract, phospholipids, linalool, limonene, citronellol, geraniol","A travel size collection featuring three Omorovicza favourites, that brings the in-spa feeling with you wherever you are. Included is the Refining Face Polisher 30ml which helps to refine skin texture, tone and brightens. Followed by the cult favorite Thermal Cleansing Balm 15ml rich in Hungarian Moor Mud, it helps to clear congested pores, draw out impurities and makeup. Finally, the Deep Cleansing Mask 15ml brightens skin tone and leaves it more supple.",Skin Care Packs,
Omorovicza,Glow Discovery Set,$264.00 ,HydratingExfoliatingFades pigmentation,A collection of Omorovicza favourites.,https://www.mecca.com.au/on/demandware.static/-/Sites-mecca-online-catalog/default/dw759da737/product/omorovicza/hr/i-045642-glow-discovery-set-1-940.jpg,"Aqua (hungarian thermal water), glycerin, cetearyl ethylhexanoate, caprylic/capric triglyceride, cetearyl olivate, helianthus annuus (sunflower) seed oil, sorbitan olivate, stearic acid, yeast extract, prunus armeniaca (apricot) kernel oil, cetearyl alcohol, butyrospermum parkii (shea butter), calendula officinalis flower extract, xanthan gum, tocopherol, leuconostoc/radish root ferment filtrate, phospholipids, lactic acid, parfum / fragrance, disodium edta, sodium levulinate, sodium anisate, dehydroacetic acid, benzyl alcohol, sodium hydroxide, linalool, benzyl salicylate, citronellol geraniol, limonene, Aqua (hungarian thermal water), glycerin, sodium cocoyl isethionate, sorbitol, disodium lauryl sulfosuccinate, sodium chloride, phenoxyethanol, saccharomyces (hungarian thermal water) ferment extract, limonene, xanthan gum, parfum (fragrance), copper gluconate, linalool, ethylhexylglycerin, disodium edta, pyrus malus (apple) fruit extract, phospholipids, chlorella vulgaris/lupinus albus proteine ferment, pectin, Aqua (hungarian thermal water), glycerin, propanediol, sodium ascorbyl phosphate, alcohol, yeast extract, sclerotium gum, sodium levulinate, alcohol denat., niacinamide, sodium anisate, xanthan gum, zinc pca, potassium sorbate, citric acid, caprylyl/capryl glucoside, benzyl alcohol, parfum (fragrance), ci 77891 (titanium dioxide), chlorella vulgaris/lupinus albus protein ferment, nasturtium officinale flower/leaf extract, sodium hyaluronate, phospholipids, leuconostoc/radish root ferment filtrate, sodium benzoate, actinidia arguta fruit extract, limonene, linalool, benzyl salicylate, citronellol, geraniol, Prunus amygdalus dulcis (sweet almond) oil, caprylic/capric triglyceride, prunus armeniaca (apricot) kernel oil, bakuchiol, borago officinalis seed oil, gossypium herbaceum (cotton) seed oil, oenothera biennis (evening primrose) oil, simmondsia chinensis (jojoba) seed oil, rosa canina fruit oil, linum usitatissimum (linseed) seed oil, fragrance, hippophae rhamnoides oil, algae (alaria esculents) extract, brassica campestris (rapeseed) seed oil, rosmarinus officinalis (rosemary) leaf extract, tocopherol, helianthus annuus (sunflower) seed oil, linalool, geraniol, cinnamyl alcohol","Get your glow on with this luxurious set from Omorovicza, featuring four favourites designed to cleanse, hydrate and brighten. Included is the Cleansing Foam 30ml to gently cleanse skin and remove makeup and impurities. The Queen of Hungary Mist 30ml which refreshes and deeply hydrates. The Daily Vitamin C 30ml an antioxidant rich serum that helps to boost collagen production and protects against free radicals. Lastly, the Miracle Facial Oil 5ml a deeply hydrating age-defying oil that stimulates the skin's repair process.",Skin Care Packs,
Kylie Skin,Face Moisturizer,$40.00 ,VeganHydratingSulphate-freeParaben-freeFragrance-free,A daily facial moisturiser for all skin types.,https://www.mecca.com.au/on/demandware.static/-/Sites-mecca-online-catalog/default/dwdc7481f3/product/kylies/hr/i-047476-kylie-skin-face-moisturizer-1-940.jpg,"Water/aqua/eau, isopropyl palmitate, propanediol, dicaprylyl carbonate, jojoba esters, glycerin, butyrospermum parkii (shea) butter, dimethicone, sorbitan stearate, stearic acid, glyceryl stearate, peg-100 stearate, coco-caprylate/caprate, prunus amygdalus dulcis (sweet almond) oil, phenoxyethanol, cetyl alcohol, hydroxyethyl acrylate/sodium acryloyldimethyl taurate copolymer, polysorbate 40, chlorphenesin, avena sativa (oat) bran extract, carbomer, musa sapientum (banana) leaf extract, trisodium ethylenediamine disuccinate, fructose, ethylhexylglycerin, aminomethyl propanol, citrus aurantium dulcis (orange) peel extract, polysorbate 60, sorbitan isostearate, withania somnifera root extract, backhousia citriodora leaf extract, sodium hyaluronate, aloe barbadensis leaf juice, tocopherol, potassium sorbate, citric acid, actinidia chinensis (kiwi) seed oil","This non-comedogenic, fragrance-free moisturiser will slot into any and all beauty regimens seamlessly. Suitable for all skin types, this daily facial moisturiser conditions the skin for a soft-to-the touch finish thanks to oat and orange-peel extracts while shea butter helps moisturise and sodium hyaluronate hydrates and plumps. Formulated with a combination of humectants and emollients, skin is left hydrated and, importantly, never greasy or oily. Use in the morning to create the perfect base for your makeup or before bed for continuous hydration while you sleep.",Moisturiser,Moisturiser
REN Clean Skincare,Ready Steady Glow Daily AHA Tonic,$72.00 ,VeganExfoliatingParaben-free,A daily tonic to boost radiance.,https://www.mecca.com.au/on/demandware.static/-/Sites-mecca-online-catalog/default/dw64eaa3bc/product/ren/hr/i-045842-ready-steady-glow-daily-aha-tonic-500ml-1-940.jpg,"Aqua (water), sodium lactate, lactic acid, heptyl glucoside, potassium azeloyl diglycinate, triethyl citrate, glyceryl caprylate, salix nigra (willow) bark extract, benzoic acid, citrus nobilis (mandarin) peel oil, citrus aurantium dulcis (orange) flower oil, citrus grandis (grapefruit) peel oil, citrus tangerina (tangerine) peel oil, heptanol, parfum (fragrance), limonene","Keep your skin looking healthy and clean with this ingenious tonic, gentle enough to use daily yet potent enough to exfoliate and brighten. This luscious liquid uncovers beautifully balanced radiance by gently exfoliating the skin, promoting cell renewal and unclogging the pores. Lactic and azelaic acids combined with white willow bark boost and brighten your complexion, contributing to that enviable glow that you have been lusting after.",Cleanser & Toner,Toner
Origins,Best of The Season Gift Set,$16.00 ,Paraben-free,"Skincare trio to cleanse, soothe and hydrate.",https://www.mecca.com.au/on/demandware.static/-/Sites-mecca-online-catalog/default/dw1b4ab1f7/product/origin/hr/i-045837-black-friday-2021-set-1-940.jpg,"Water/aqua/eau; lavandula angustifolia (lavender) flower water,  myristic acid,  glycerin,  behenic acid,  sodium methyl cocoyl taurate,  palmitic acid,  potassium hydroxide,  lauric acid,  stearic acid,  anthemis nobilis flower oil , mentha viridis (spearmint) leaf oil, pelargonium graveolens flower oil, lavandula hybrida oil, citrus aurantium bergamia (bergamot) fruit oil, styrax benzoin gum, linalool,  peg-3 distearate,  tourmaline,  laminaria saccharina extract,  hydrolyzed wheat protein,  cetearyl alcohol,  polyquaternium-7,  butylene glycol,  disodium edta,  methylchloroisothiazolinone,  methylisothiazolinone  essential oil, Water/aqua/eau, carthamus tinctorius (safflower) seed oil, butylene glycol, squalane, peg-100 stearate, caprylic/capric triglyceride, glyceryl stearate, tribehenin, glycerin, cetearyl alcohol, euphorbia cerifera (candelilla) wax/candelilla cera/cire de candelilla, kaolin, citrus aurantium dulcis (orange) oil lavandula angustifolia (lavender) oil, pogostemon cablin (patchouli) oil, citrus nobilis (mandarin orange) peel oil, pelargonium graveolens flower oil, boswellia carterii (olibanum) oil , limonene, linalool, citronellol, geraniol, citral, ganoderma lucidum (reishi mushroom) extract, fuscoporia obliqua sclerotium extract, cordyceps sinensis (mushroom) extract, ergothioneine, camelina sativa seed oil, lactobacillus ferment, hippophae rhamnoides extract, zingiber officinale (ginger) root extract, ocimum sanctum (holy basil) leaf extract, curcuma longa (turmeric) root extract, olea europaea (olive) leaf extract, silybum marianum fruit extract, persea gratissima (avocado) fruit extract, ascophyllum nodosum extract, sucrose, astrocaryum murumuru seed butter, asparagopsis armata extract, yeast extract/faex/extrait de levure, cladosiphon okamuranus extract, hypnea musciformis (algae) extract, behenyl alcohol, sorbitol, trehalose, adansonia digitata seed oil, caprylyl glycol, caffeine, gellidiella acerosa extract, calcium carbonate, helianthus annuus (sunflower) seed oil, polysorbate 20, phytosterols, maltodextrin, tocotrienols, phytosphingosine, squalene, saccharomyces ferment filtrate, tocopherol, sodium hyaluronate, potassium hydroxide, carbomer, hexylene glycol, elaeis guineensis (palm) oil, dextrin, phenoxyethanol, iron oxides (ci 77491, ci 77492, ci 77499), titanium dioxide (ci 77891) organic safflower oil, organic sunflower oil, organic sea buckthorn extract, organic ginger extract, organic turmeric extract, organic sucrose (brown sugar)organic essential oils: organic orange oil, organic mandarin oil, organic patchouli oil, organic geranium oil, organic lavender oilessential oil, Water, Methyl Trimethicone, Butylene Glycol, Glycerin, Jojoba Esters, Panthenol, Dicaprylyl Carbonate, Citrus Limon (Lemon) Peel Oil, Citrus Grandis (Grapefruit) Peel Oil, Mentha Viridis (Spearmint) Leaf Oil, Limonene, Aloe Barbadensis Leaf Extract, Butyrospermum Parkii (Shea Butter), Simmondsia Chinensis (Jojoba) Butter, Castanea Sativa (Chestnut) Seed Extract, Rubus Idaeus (Raspberry) Leaf Wax, Dimethicone, Coleus Barbatus Extract, Hordeum Vulgare (Barley) Extract/Extrait D'Orge, Trehalose, Triticum Vulgare (Wheat) Germ Extract, Panax Ginseng (Ginseng) Root Extract, Ammonium Acryloyldimethyltaurate/Vp Copolymer, Salicylic Acid, Foeniculum Vulgare (Fennel) Seed Extract, Rosmarinus Officinalis (Rosemary) Leaf Extract, Phospholipids, Tocopheryl Acetate, Sodium Pca, Arginine, Caffeine, Cholesterol, Linoleic Acid, Biotin, Folic Acid, Tetrahexyldecyl Ascorbate, Polysilicone-11, Carbomer, Pantethine, Squalane, Sodium Hyaluronate, Hexylene Glycol, Lecithin, Calcium Carbonate, Caprylyl Glycol, Ethylhexylglycerin, Tromethamine, Phenoxyethanol, Essential Oil","A skincare trio designed to cleanse, soothe and hydrate. Included is Origins best selling Checks and Balances  Frothy Face Wash, to wash away dirt, oils and makeup. Next, Mega-Mushroom Relief & Resilience Soothing Treatment Lotion to instantly refresh, hydrate and soothe skin. Lastly, GinZing  Oil-Free Energy-Boosting Gel Moisturizer that drenches skin in 72 hour hydration and boosts radiance. ",Skin Care Packs,
